keyword,volume,kd,cpc,intent
seo keyword research tool,1900,38,4.2,commercial
best keyword research tools,8100,57,6.5,commercial
free keyword clustering tool,900,21,2.1,transactional
how to do keyword research,5400,42,3.4,informational
seo keyword gap analysis,700,30,5.0,commercial
long tail keyword finder,2300,35,3.1,commercial
keyword intent mapping,500,18,2.8,informational
local seo keyword research,1500,29,4.9,commercial
programmatic seo keywords,850,26,5.4,informational
ai keyword research workflow,600,22,4.0,informational
